Артикул(1);Наименование(2);Бренд(3);Склад;Количество(5);Цена(6);Распродажа;Мин. заказ;Срок поставки (Рабочие дни);Уцененный товар;Авиадоставка;Товар в пути256-63152-00;Насос ручной для замены масла в редукторе;РРЦ РАЗНОЕ;Хабаровск;0.000;595;;1;0;;;900-00061;Спидометр аналоговый до 60 км/ч с GPS-модулем (белый, хромированный ободок);РРЦ РАЗНОЕ;Хабаровск;1.000;5576;;1;0;;;90790BS80700;Масло редукторное Yamalube Gear Oil GL-4  (750мл);YAMALUBE;Хабаровск;37.000;1955;;1;0;;;90790BS80600;Масло редукторное Yamalube Gear Oil Sae 90 GL-4  (350мл);YAMALUBE;Хабаровск;0.000;1258;;1;0;;;1233100-001-01-999;Масло трансмиссионное Ravenol Marine Gear 1L;МАСЛО/СВЕЧИ;Хабаровск;53.000;1980;;1;0;;;2566315200;Насос ручной для замены масла в редукторе ПЛМ;РРЦ РАЗНОЕ;Хабаровск;9.000;880;;1;0;;;DPN85SPB-120KMH-G;Спидометр аналоговый до 120 км/ч с GPS-модулем (черный, хромированный ободок) (DEPO);DEPO;Хабаровск;26.000;4219;;1;0;;;DP-14;Насос ручной для перекачки жидкостей и ГСМ, 7 л/м;РРЦ РАЗНОЕ;Хабаровск;1.000;240;;1;0;;;90790BS82000;Масло редукторное Yamalube Gear Oil SAE 90 GL-5 (1л);YAMALUBE;Хабаровск;14.000;2295;;1;0;;;GS-600-AM-R;Смазка-спрей загустевающая ABRO 272г.;МАСЛО/СВЕЧИ;Хабаровск;1.000;312;;1;0;;;858064QB1;Масло редукторное QUICKSILVER SAE 90 HIGH PERFORMANCE (1л);МАСЛО/СВЕЧИ;Хабаровск;24.000;3145;;1;0;;;FO-400-AM-RE;Смазка-спрей консервант Fogging oil ABRO MASTERS 400 мл;МАСЛО/СВЕЧИ;Хабаровск;1.000;382.5;;1;0;;;